Вопрос,Ответы
Какие чувства ты хочешь вызывать своим контентом?,"Какие чувства я хочу вызывать своим контентом?

1. Инсайт: чтобы у человека было ощущение, что он наконец-то понял, как это реально работает.
2. Понимание: чтобы у него появлялось понимание, как вообще работает маркетинг и как он может использовать это именно для себя, и что ему нужно. То есть у него есть какая-то цель, какая-то боль, и что ему нужно предпринять, какие действия должны быть, чтобы он приблизился к цели.
3. Не «как сделать», а «что нужно»: не про то, как это сделать, потому что как сделать — этому нужно обучаться, есть специалисты-маркетологи. Приходите, я помогу. А именно что нужно, чтобы убрать мифы на рынке, которые существуют, которые плодят инфоцыгане, вот эти вот блогеры, и убрать вот эти офферы типа «создавайте автоворонки, у вас будут идти клиенты 24/7 без вашего включения» — да бредятина это полная.
4. Вдохновение и мотивация: вдохновение, заряд мотивации, понимание, что да, всё работает на самом деле. Маркетинг работает, просто его делали неправильно.
5. Доверие: понимание, что я эксперт, и я хочу вызывать доверие."
Каких блогеров сам смотришь?,"Каких блогеров я смотрю?

На самом деле я практически не смотрю блогеров в последнее время. Если я захожу в соцсети, я больше листаю рилсы и смотрю именно там.

Из блогеров — больше знакомые:
- Оля Сок: недавно закончили работу, могу зайти посмотреть сторисы. Но я на неё даже не подписана, просто время от времени захожу.
- Наталья Пахомова: тоже время от времени, потому что мы с ней работали.
- Тимочка: но не всегда. У него больше прогревы всегда идут, и я это прекрасно понимаю. Так как это моя работа, я анализирую эти прогревы, смотрю, как он там триггерит. Но когда я устаю и не хочу анализировать, я не смотрю.
- Его жена: так же, она делает то же самое.
- Снейл Кика: смотрю, что он там выкладывает, просто потому что он стример, и мы смотрим его контент, и он там анонсы выкладывает.

Короче, я очень сильно сократила своё инфополе: кого я смотрю и изучаю, потому что устала. Очень часто используются эти прогревы, и они мне пока неинтересны. Я, наверное, больше ушла в эту бизнесовскую историю, и мне интересно смотреть, что происходит, но это больше через работу, через кейсы, через какие-то статьи."